jurisdiction,primary_legislation,year_enacted,key_requirements,transparency_obligation,watermarking_required,platform_liability,enforcement_body,cross_border_coverage,maturity_rating,notes
United States (Federal),None enacted (DEFIANCE Act proposed),2024 (proposed only),Proposed: civil remedy for non-consensual deepfakes; no federal criminal statute,No (proposed only),No,No federal standard,FTC / DOJ (proposed),No,Low,"Multiple federal bills introduced including DEFIANCE Act and NO FAKES Act; none enacted as of early 2026. Enforcement falls to FTC for deceptive practices and state AGs"
United States (California),AB 602 / AB 730 / SB 926,2019–2024,Prohibition on non-consensual deepfake intimate images; disclosure requirements for political deepfakes within 60 days of election,Yes (political ads),No,Limited (platform safe harbors apply),California AG / civil plaintiffs,No (state-level only),Moderate,"California is the most active U.S. state regulator; AB 602 (2023) creates civil cause of action for non-consensual deepfakes; does not address fraud or authentication bypass"
United States (Texas),HB 4337,2023,Prohibition on deepfakes depicting sexual conduct without consent; criminal penalties,No,No,Limited,Texas AG / criminal prosecution,No (state-level only),Moderate,"Criminal statute with penalties up to 2 years imprisonment; narrower scope than California; no civil right of action"
European Union,EU AI Act (Regulation EU 2024/1689),2024 (phased enforcement),High-risk AI transparency obligations; mandatory labeling of AI-generated content; deepfake watermarking; general-purpose AI systemic risk provisions,Yes (mandatory),Yes (synthetic media),Yes (platform obligations),EU AI Office / national competent authorities,Yes (EU single market),High,"Most comprehensive binding framework; risk-tiered approach; enforcement by EU AI Office with national implementation; significant extraterritorial reach for providers serving EU market. Full enforcement phased through 2027"
China,Deepfake Regulations (SAMR/CAC),2022–2023,"Mandatory real-name registration for deepfake creation; content labeling required; platform liability for user-generated synthetic media; prohibited uses include political manipulation and fraud",Yes (mandatory),Yes (required label),Yes (strong platform liability),Cyberspace Administration of China (CAC),Limited (domestic focus),High,"Among most assertive national frameworks; comprehensive labeling requirements; but enforcement applied inconsistently and primarily in politically sensitive contexts per international observers. Limited transparency on enforcement statistics"
United Kingdom,Online Safety Act 2023,2023,"Illegal content (CSAM deepfakes criminalized); harmful content duties for platforms; deepfake intimate imagery sharing made criminal offense under Criminal Justice Bill 2024",Yes (for certain categories),No,Yes (systemic duties),Ofcom,No (UK domestic),Moderate,"Online Safety Act creates positive platform duties; Criminal Justice Bill (2024) adds specific deepfake intimate imagery offense; no general AI content transparency requirement yet"
Australia,No dedicated legislation,—,Existing criminal law applied to some deepfake misuse; Online Safety Act covers some harmful content; no deepfake-specific transparency or watermarking requirements,No,No,Limited (existing frameworks),eSafety Commissioner (limited),No,Low,"Regulatory review underway as of 2026; Australian Law Reform Commission examining deepfake harms; no comprehensive framework enacted"
